Symbol,Name,Last Sale,Net Change,% Change,Market Cap,Country,IPO Year,Volume,Sector,Industry
CTV,Innovid Corp. Common Stock,$1.73,0.01,0.581%,253284882.00,,2021,73357,Technology,Computer Software: Prepackaged Software
CTVA,Corteva Inc. Common Stock ,$58.33,0.24,0.413%,40378767510.00,United States,2019,1326973,Consumer Staples,Farming/Seeds/Milling
CTXR,Citius Pharmaceuticals Inc. Common Stock,$0.434,-0.0116,-2.603%,78434827.00,United States,,822587,Health Care,Biotechnology: Pharmaceutical Preparations
CUB,Lionheart Holdings Class A Ordinary Shares,$10.012,-0.003,-0.03%,318066983.00,United States,2024,528166,Industrials,Industrial Machinery/Components
CUBA,Herzfeld Caribbean Basin Fund Inc. (The) Common Stock,$2.285,0.055,2.466%,0.00,United States,,97031,Finance,Investment Managers
CUBB,Customers Bancorp Inc 5.375% Subordinated Notes Due 2034,$20.70,0.2392,1.169%,656141107.00,United States,2019,4093,Finance,Major Banks
CUBE,CubeSmart Common Shares,$51.16,-0.91,-1.748%,11521166976.00,United States,,2096236,Real Estate,Real Estate Investment Trusts
CUBI,Customers Bancorp Inc Common Stock,$45.34,0.30,0.666%,1437170907.00,United States,,282148,Finance,Major Banks
CUBI^E,Customers Bancorp Inc Fixed-to-Floating Rate Non-Cumulative Perpetual Preferred Stock Series E,$25.60,0.23,0.907%,,United States,,4958,,
CUBI^F,Customers Bancorp Inc Fixed-to-Floating Rate Non-Cumulative Perpetual Preferred Stock Series F,$25.28,0.05,0.198%,,United States,,397,,
CUBWU,Lionheart Holdings Unit,$10.02,-0.15,-1.475%,0.00,United States,2024,225,Finance,Blank Checks
CUBWW,Lionheart Holdings Warrant,$0.0651,0.0004,0.618%,0.00,United States,2024,1527,,
CUE,Cue Biopharma Inc. Common Stock,$1.16,0.3408,41.602%,56426247.00,United States,2018,6035331,Health Care,Biotechnology: Pharmaceutical Preparations
CUK,Carnival Plc ADS ADS,$16.35,0.70,4.473%,21939201082.00,United States,,2024790,Consumer Discretionary,Marine Transportation
CULP,Culp Inc. Common Stock,$5.95,0.02,0.337%,74317166.00,United States,,27074,Consumer Discretionary,Textiles
CURB,Curbline Properties Corp. Common Stock,$23.44,0.84,3.717%,2457923604.00,United States,2024,2690675,Finance,Real Estate
CURI,CuriosityStream Inc. Class A Common Stock,$1.89,-0.06,-3.077%,103194597.00,United States,2020,61730,Consumer Discretionary,Movies/Entertainment
CURIW,CuriosityStream Inc. Warrant,$0.0347,0.0141,68.447%,1894631.00,United States,2020,301,Consumer Discretionary,Movies/Entertainment
CURR,Currenc Group Inc. Ordinary Shares,$2.31,0.0099,0.43%,24430907.00,Singapore,,3351,Consumer Discretionary,Business Services
CURV,Torrid Holdings Inc. Common Stock,$3.55,0.10,2.899%,371614817.00,,2021,369515,Consumer Discretionary,Clothing/Shoe/Accessory Stores
CUTR,Cutera Inc. Common Stock,$0.7497,0.0201,2.755%,15089843.00,United States,2004,69650,Health Care,Biotechnology: Electromedical & Electrotherapeutic Apparatus
CUZ,Cousins Properties Incorporated Common Stock,$28.93,0.09,0.312%,4401415639.00,United States,,744879,Real Estate,Real Estate Investment Trusts
CVAC,CureVac N.V. Ordinary Shares,$3.02,0.06,2.027%,676445799.00,Germany,2020,345524,Health Care,Biotechnology: Pharmaceutical Preparations
CVBF,CVB Financial Corporation Common Stock,$18.05,-0.01,-0.055%,2521275894.00,United States,,655156,Finance,Major Banks
CVCO,Cavco Industries Inc. Common Stock When Issued,$422.28,-7.24,-1.686%,3485191700.00,United States,,53313,Consumer Discretionary,Homebuilding
CVE,Cenovus Energy Inc Common Stock,$18.27,0.43,2.41%,33910983540.00,Canada,,12080865,Energy,Oil & Gas Production
CVEO,Civeo Corporation (Canada) Common Shares,$27.61,0.57,2.108%,396782951.00,,2014,22860,Consumer Discretionary,Hotels/Resorts
CVGI,Commercial Vehicle Group Inc. Common Stock,$3.17,0.05,1.603%,109370614.00,United States,2004,77025,Consumer Discretionary,Auto Parts:O.E.M.
CVGW,Calavo Growers Inc. Common Stock,$28.50,0.52,1.858%,507344859.00,United States,,132295,Consumer Discretionary,Specialty Foods
CVI,CVR Energy Inc. Common Stock,$24.66,-0.27,-1.083%,2479084571.00,United States,2007,875576,Energy,Integrated oil Companies
CVKD,Cadrenal Therapeutics Inc. Common Stock,$12.00,0.60,5.263%,12806772.00,United States,2023,37065,Health Care,Biotechnology: Pharmaceutical Preparations
CVLG,Covenant Logistics Group Inc. Class A Common Stock,$50.29,0.39,0.782%,662362952.00,United States,,33481,Industrials,Trucking Freight/Courier Services
CVLT,Commvault Systems Inc. Common Stock,$153.19,2.44,1.619%,6696446861.00,United States,2006,162959,Technology,Computer Software: Prepackaged Software
CVM,Cel-Sci Corporation Common Stock,$1.08,-0.01,-0.917%,66412687.00,United States,1997,210462,Health Care,Biotechnology: Biological Products (No Diagnostic Substances)
CVNA,Carvana Co. Class A Common Stock,$180.17,3.53,1.998%,37285020845.00,United States,2017,2273525,Consumer Discretionary,Retail-Auto Dealers and Gas Stations
CVR,Chicago Rivet & Machine Co. Common Stock,$18.10,0.10,0.556%,17486989.00,United States,1930,1215,Industrials,Industrial Machinery/Components
CVRX,CVRx Inc. Common Stock,$8.78,0.25,2.931%,191278569.00,United States,2021,119020,Health Care,Medical/Dental Instruments
CVS,CVS Health Corporation Common Stock,$64.59,1.67,2.654%,81252881049.00,United States,,16313877,Consumer Staples,Retail-Drug Stores and Proprietary Stores
CVU,CPI Aerostructures Inc. Common Stock,$3.402,0.032,0.95%,44350588.00,United States,2022,24038,Industrials,Military/Government/Technical
CVV,CVD Equipment Corporation Common Stock,$3.17,-0.11,-3.354%,21815426.00,United States,,10737,Technology,Industrial Machinery/Components
CVX,Chevron Corporation Common Stock,$150.74,-0.51,-0.337%,275690965614.00,United States,,7895285,Energy,Integrated oil Companies
CW,Curtiss-Wright Corporation Common Stock,$337.50,-0.27,-0.08%,12926026575.00,United States,,210125,Technology,Industrial Machinery/Components
CWAN,Clearwater Analytics Holdings Inc. Class A Common Stock,$25.38,0.36,1.439%,6251695354.00,United States,2021,771020,Technology,Computer Software: Prepackaged Software
CWBC,Community West Bancshares Common Stock,$18.01,-0.03,-0.166%,341119450.00,United States,,25213,Finance,Major Banks
CWCO,Consolidated Water Co. Ltd. Ordinary Shares,$24.99,0.13,0.523%,395703130.00,Cayman Islands,,44733,Utilities,Water Supply
CWD,CaliberCos Inc. Class A Common Stock,$0.5999,0.0459,8.285%,13224827.00,United States,2023,8085,Finance,Real Estate
CWEN,Clearway Energy Inc. Class C Common Stock,$29.56,0.36,1.233%,3458520000.00,United States,2015,1083074,Utilities,Electric Utilities: Central
CWH,Camping World Holdings Inc. Class A Common Stock,$23.44,0.40,1.736%,2115650450.00,United States,2016,1083369,Consumer Discretionary,Retail-Auto Dealers and Gas Stations
CWK,Cushman & Wakefield plc Ordinary Shares,$12.62,-0.60,-4.539%,2893132552.00,,2018,2470935,Finance,Real Estate
CWST,Casella Waste Systems Inc. Class A Common Stock,$98.95,-0.30,-0.302%,5752349108.00,United States,1997,202441,Utilities,Environmental Services
CWT,California Water Service Group Common Stock,$53.08,0.16,0.302%,3122437210.00,United States,,146517,Utilities,Water Supply
CX,Cemex S.A.B. de C.V. Sponsored ADR,$5.92,-0.05,-0.838%,8578595182.00,Mexico,,7269831,Industrials,Building Materials
CXAI,CXApp Inc. Class A Common Stock,$1.57,0.05,3.289%,23969126.00,United States,2021,132656,Technology,EDP Services
CXAIW,CXApp Inc. Warrant,$0.2575,0.0196,8.239%,3931242.00,United States,2021,13175,Technology,EDP Services
CXDO,Crexendo Inc. Common Stock,$4.64,0.22,4.977%,123957168.00,United States,,50092,Telecommunications,Telecommunications Equipment
CXE,MFS High Income Municipal Trust Common Stock,$3.92,-0.0517,-1.302%,123581030.00,United States,1989,125340,Finance,Investment Managers
CXH,MFS Investment Grade Municipal Trust Common Stock,$8.20,-0.05,-0.606%,74704009.00,United States,1989,42761,Finance,Investment Managers
CXM,Sprinklr Inc. Class A Common Stock,$7.46,0.29,4.045%,1890874868.00,United States,2021,1054043,Technology,Computer Software: Prepackaged Software
CXT,Crane NXT Co. Common Stock,$55.88,0.57,1.031%,3192815839.00,United States,,570735,Industrials,Metal Fabrications
CXW,CoreCivic Inc. Common Stock,$12.61,0.10,0.799%,1390511156.00,United States,,844376,Real Estate,Real Estate Investment Trusts
CYBN,Cybin Inc. Common Shares,$9.25,0.41,4.638%,184925149.00,Canada,,92270,Health Care,Biotechnology: Pharmaceutical Preparations
CYBR,CyberArk Software Ltd. Ordinary Shares,$280.34,1.29,0.462%,11845860894.00,Israel,2014,297001,Technology,Computer Software: Prepackaged Software
CYCC,Cyclacel Pharmaceuticals Inc. Common Stock,$0.9134,-0.0065,-0.707%,1803238.00,United States,,13447,Health Care,Biotechnology: Pharmaceutical Preparations
CYCCP,Cyclacel Pharmaceuticals Inc. 6% Convertible Preferred Stock,$7.00,0.22,3.245%,13819428.00,United States,,3055,Health Care,Biotechnology: Pharmaceutical Preparations
CYCN,Cyclerion Therapeutics Inc. Common Stock,$2.43,-0.08,-3.187%,6585533.00,United States,,1423,Health Care,Biotechnology: Pharmaceutical Preparations
CYD,China Yuchai International Limited Common Stock,$12.38,-0.02,-0.161%,505825630.00,Singapore,1994,15555,Industrials,Industrial Machinery/Components
CYH,Community Health Systems Inc. Common Stock,$5.64,0.27,5.028%,783641487.00,United States,2000,1113142,Health Care,Hospital/Nursing Management
CYN,Cyngn Inc. Common Stock,$3.74,-0.03,-0.796%,7579233.00,United States,2021,37920,Technology,EDP Services
CYRX,CryoPort Inc. Common Stock,$7.89,0.02,0.254%,389863000.00,United States,,233287,Health Care,Biotechnology: Pharmaceutical Preparations
CYTH,Cyclo Therapeutics Inc. Common Stock,$0.7412,0.0305,4.292%,21269496.00,United States,,25481,Health Care,Biotechnology: Biological Products (No Diagnostic Substances)
CYTHW,Cyclo Therapeutics Inc. Warrant,$0.08,0.00,0.00%,2295682.00,United States,,10,Health Care,Biotechnology: Biological Products (No Diagnostic Substances)
CYTK,Cytokinetics Incorporated Common Stock,$56.68,0.97,1.741%,6668944881.00,United States,2004,1190130,Health Care,Biotechnology: Pharmaceutical Preparations
CYTO,Altamira Therapeutics Ltd. Common Shares,$0.6593,0.0493,8.082%,2129539.00,Bermuda,2014,52314,Health Care,Biotechnology: Pharmaceutical Preparations
CZFS,Citizens Financial Services Inc. Common Stock,$52.33,-0.10,-0.191%,249087189.00,United States,,10044,Finance,Major Banks
CZNC,Citizens & Northern Corp Common Stock,$18.80,0.32,1.732%,289377947.00,United States,,18618,Finance,Major Banks
CZR,Caesars Entertainment Inc. Common Stock,$44.47,0.62,1.414%,9620549748.00,United States,,3786417,Consumer Discretionary,Hotels/Resorts
CZWI,Citizens Community Bancorp Inc. Common Stock,$14.04,-0.03,-0.213%,144574668.00,United States,2006,2230,Finance,Savings Institutions
D,Dominion Energy Inc. Common Stock,$58.23,0.15,0.258%,48851382974.00,United States,,2459670,Utilities,Electric Utilities: Central
DAC,Danaos Corporation Common Stock,$86.61,-0.67,-0.768%,1681853261.00,Greece,2006,122294,Consumer Discretionary,Marine Transportation
DADA,Dada Nexus Limited American Depositary Shares,$2.26,0.10,4.63%,596815921.00,China,2020,3065789,Technology,Computer Software: Programming Data Processing
DAIO,Data I/O Corporation Common Stock,$2.46,0.01,0.408%,22719741.00,United States,1981,5019,Industrials,Electrical Products
DAKT,Daktronics Inc. Common Stock,$13.15,0.08,0.612%,613432548.00,United States,1994,362317,Consumer Discretionary,Miscellaneous manufacturing industries
DAL,Delta Air Lines Inc. Common Stock,$49.28,1.82,3.835%,31806264484.00,United States,,8581150,Consumer Discretionary,Air Freight/Delivery Services
DALN,DallasNews Corporation Series A Common Stock,$4.13,0.02,0.487%,22105784.00,United States,,28400,Consumer Discretionary,Newspapers/Magazines
DAN,Dana Incorporated Common Stock ,$10.98,0.29,2.713%,1591850996.00,United States,,1711330,Consumer Discretionary,Auto Parts:O.E.M.
DAO,Youdao Inc. American Depositary Shares each representing one Class A Ordinary Share,$5.48,0.35,6.823%,662642422.00,China,2019,288424,Real Estate,Other Consumer Services
DAR,Darling Ingredients Inc. Common Stock,$36.94,0.83,2.299%,5874344565.00,United States,1997,943902,Consumer Staples,Packaged Foods
DARE,Dare Bioscience Inc. Common Stock,$3.2294,0.0494,1.553%,27599618.00,United States,2014,20811,Health Care,Biotechnology: Pharmaceutical Preparations
DASH,DoorDash Inc. Class A Common Stock,$144.86,2.74,1.928%,59615876774.00,United States,,2658645,Consumer Discretionary,Business Services
DATS,DatChat Inc. Common Stock,$1.23,-0.0114,-0.918%,3701475.00,United States,2021,5885,Telecommunications,Telecommunications Equipment
DATSW,DatChat Inc. Series A Warrant,$0.0495,0.0156,46.018%,148962.00,United States,2021,150,Telecommunications,Telecommunications Equipment
DAVA,Endava plc American Depositary Shares (each representing one Class A Ordinary Share),$25.37,0.45,1.806%,1497627430.00,United Kingdom,2018,525157,Technology,EDP Services
DAVE,Dave Inc. Class A Common Stock,$43.07,3.15,7.891%,545664167.00,United States,,266222,Finance,Finance: Consumer Services
DAVEW,Dave Inc. Warrants,$0.057,0.0015,2.703%,722147.00,United States,,6980,Finance,Finance: Consumer Services
DAWN,Day One Biopharmaceuticals Inc. Common Stock,$14.10,0.30,2.174%,1386171000.00,United States,2021,1123382,Health Care,Biotechnology: Pharmaceutical Preparations
DAY,Dayforce Inc. Common Stock,$61.86,0.27,0.438%,9780066000.00,United States,2018,755031,Technology,Computer Software: Prepackaged Software
DB,Deutsche Bank AG Common Stock,$17.42,0.52,3.077%,35536800000.00,Germany,,1567810,Finance,Major Banks
DBD,Diebold Nixdorf Incorporated Common stock,$44.26,1.58,3.702%,1662700726.00,United States,2023,134885,Miscellaneous,Office Equipment/Supplies/Services
DBGI,Digital Brands Group Inc. Common Stock,$0.299,-0.0117,-3.766%,782491.00,United States,2021,915353,Consumer Discretionary,Clothing/Shoe/Accessory Stores
DBGIW,Digital Brands Group Inc. Warrant,$12.31,-1.39,-10.146%,32215602.00,United States,2021,1102,Consumer Discretionary,Clothing/Shoe/Accessory Stores
DBI,Designer Brands Inc. Class A Common Stock,$6.82,0.08,1.187%,378506460.00,United States,,1477398,Consumer Discretionary,Clothing/Shoe/Accessory Stores
DBL,DoubleLine Opportunistic Credit Fund Common Shares of Beneficial Interest,$15.89,0.05,0.316%,0.00,United States,2012,48002,,
DBRG,DigitalBridge Group Inc.,$15.05,0.43,2.941%,2616671606.00,United States,2014,3577879,Real Estate,Real Estate Investment Trusts
DBRG^H,DigitalBridge Group Inc. 7.125% Series H ,$25.35,-0.08,-0.315%,,United States,,4489,,
DBRG^I,DigitalBridge Group Inc. 7.15% Series I ,$25.45,-0.12,-0.469%,,United States,,4942,,
DBRG^J,DigitalBridge Group Inc. 7.125% Series J ,$25.20,0.08,0.318%,,United States,,7681,,
DBVT,DBV Technologies S.A. American Depositary Shares,$0.70,0.02,2.941%,67549249.00,France,2014,110371,Health Care,Biotechnology: Biological Products (No Diagnostic Substances)
DBX,Dropbox Inc. Class A Common Stock,$25.37,-0.16,-0.627%,8255844512.00,United States,2018,3368910,Technology,Computer Software: Prepackaged Software
DC,Dakota Gold Corp. Common Stock,$2.27,0.03,1.339%,212613800.00,United States,2022,63677,Basic Materials,Metal Mining
DCBO,Docebo Inc. Common Shares,$43.36,0.99,2.337%,1310812995.00,Canada,,24351,Technology,Computer Software: Prepackaged Software
DCF,BNY Mellon Alcentra Global Credit Income 2024 Target Term Fund Inc. Common Stock,$9.21,0.01,0.109%,0.00,,2017,10938,Finance,Finance/Investors Services
DCGO,DocGo Inc. Common Stock,$3.35,0.20,6.349%,342762704.00,United States,2020,570814,Health Care,Medical/Nursing Services
DCI,Donaldson Company Inc. Common Stock,$73.70,0.48,0.656%,8824255844.00,United States,,459664,Industrials,Pollution Control Equipment
DCO,Ducommun Incorporated Common Stock,$65.34,0.21,0.322%,963646996.00,United States,,25310,Industrials,Military/Government/Technical
DCOM,Dime Community Bancshares Inc. Common Stock,$28.16,0.21,0.751%,1102425618.00,United States,,144503,Finance,Major Banks
DCOMG,Dime Community Bancshares Inc. 9.000% Fixed-to-Floating Rate Subordinated Notes due 2034,$27.00,-0.145,-0.534%,1057013199.00,United States,,2452,Finance,Major Banks
DCOMP,Dime Community Bancshares Inc. Fixed-Rate Non-Cumulative Perpetual Preferred Stock Series A,$20.45,0.09,0.442%,800589627.00,United States,,4107,Finance,Major Banks
DCTH,Delcath Systems Inc. Common Stock,$8.77,0.16,1.858%,245555808.00,United States,,161414,Health Care,Medical/Dental Instruments
DD,DuPont de Nemours Inc. Common Stock,$87.54,0.40,0.459%,36547522192.00,United States,2017,845503,Industrials,Major Chemicals
DDC,DDC Enterprise Limited Class A Ordinary Shares,$0.338,0.0288,9.314%,7290660.00,,2023,513005,Consumer Staples,Packaged Foods
DDD,3D Systems Corporation Common Stock,$2.86,0.11,4.00%,382020999.00,United States,,2316596,Technology,Computer Software: Prepackaged Software
DDI,DoubleDown Interactive Co. Ltd. American Depository Shares,$14.98,-0.02,-0.133%,742310531.00,South Korea,2021,65557,Technology,EDP Services
DDL,Dingdong (Cayman) Limited American Depositary Shares (each two representing three Ordinary Shares),$3.77,0.08,2.168%,681766800.00,Cayman Islands,2021,1370149,Consumer Discretionary,Catalog/Specialty Distribution
DDOG,Datadog Inc. Class A Common Stock,$122.69,5.16,4.39%,38170130068.00,United States,2019,5219974,Technology,Computer Software: Prepackaged Software
DDS,Dillard's Inc. Common Stock,$366.78,3.90,1.075%,5934098042.00,United States,,130868,Consumer Discretionary,Department/Specialty Retail Stores
DDT,Dillard's Capital Trust I,$26.0127,0.0127,0.049%,420856950.00,United States,,3441,Consumer Discretionary,Department/Specialty Retail Stores
DE,Deere & Company Common Stock,$407.99,-0.75,-0.183%,111625989746.00,United States,,877896,Industrials,Industrial Machinery/Components
DEA,Easterly Government Properties Inc. Common Stock,$13.29,-0.04,-0.30%,1369329861.00,United States,2015,628713,Real Estate,Real Estate Investment Trusts
DEC,Diversified Energy Company plc Ordinary Shares,$11.92,0.16,1.361%,583522144.00,,,212144,,
DECA,Denali Capital Acquisition Corp. Class A Ordinary Shares,$11.51,-0.06,-0.519%,0.00,United States,2022,1047,Finance,Blank Checks
DECK,Deckers Outdoor Corporation Common Stock,$166.81,10.02,6.391%,25432374215.00,United States,1993,2328481,Consumer Discretionary,Shoe Manufacturing
DEI,Douglas Emmett Inc. Common Stock,$17.94,0.45,2.573%,3003324492.00,United States,2006,2360774,Real Estate,Real Estate Investment Trusts
DELL,Dell Technologies Inc. Class C Common Stock ,$120.42,4.75,4.107%,84581169909.00,United States,2018,8185053,Technology,Computer Manufacturing
DENN,Denny's Corporation Common Stock,$6.40,0.21,3.393%,328793402.00,United States,,490533,Consumer Discretionary,Restaurants
DEO,Diageo plc Common Stock,$137.54,-0.07,-0.051%,76452481004.00,United Kingdom,,474584,Consumer Staples,Beverages (Production/Distribution)
DERM,Journey Medical Corporation Common Stock,$6.53,0.24,3.816%,135348858.00,United States,2021,112779,Health Care,Biotechnology: Pharmaceutical Preparations
DESP,Despegar.com Corp. Ordinary Shares,$13.53,0.97,7.723%,974893448.00,Argentina,2017,787293,Consumer Discretionary,Transportation Services
DFH,Dream Finders Homes Inc. Class A Common Stock,$34.30,-0.66,-1.888%,3214875305.00,United States,2022,317345,Consumer Discretionary,Homebuilding
DFIN,Donnelley Financial Solutions Inc. Common Stock ,$66.12,0.60,0.916%,1919693631.00,United States,2016,152014,Consumer Discretionary,Other Consumer Services
DFLI,Dragonfly Energy Holdings Corp. Common Stock (NV),$0.5945,0.0195,3.391%,37210451.00,United States,2021,411398,Miscellaneous,Industrial Machinery/Components
DFLIW,Dragonfly Energy Holdings Corp. Warrant,$0.021,-0.0065,-23.636%,1314415.00,United States,2021,6009,Miscellaneous,Industrial Machinery/Components
DFP,Flaherty & Crumrine Dynamic Preferred and Income Fund Inc. Common Stock,$21.35,-0.08,-0.373%,0.00,,2013,77648,Finance,Investment Managers
DFS,Discover Financial Services Common Stock,$144.89,8.52,6.248%,36377755431.00,United States,,1149460,Finance,Finance: Consumer Services
DG,Dollar General Corporation Common Stock,$84.35,2.43,2.966%,18549845770.00,United States,2009,3792959,Consumer Discretionary,Department/Specialty Retail Stores
DGHI,Digihost Technology Inc. Common Subordinate Voting Shares,$1.08,-0.01,-0.917%,35629200.00,Canada,,57527,Finance,Finance: Consumer Services
DGICA,Donegal Group Inc. Class A Common Stock,$14.43,0.03,0.208%,483169070.00,United States,,33184,Finance,Property-Casualty Insurers
DGICB,Donegal Group Inc. Class B Common Stock,$13.40,0.50,3.876%,448680910.00,United States,1986,839,Finance,Property-Casualty Insurers
DGII,Digi International Inc. Common Stock,$29.38,0.35,1.206%,1069878106.00,United States,1989,152141,Telecommunications,Computer Communications Equipment
DGLY,Digital Ally Inc. Common Stock,$1.03,0.02,1.98%,3970815.00,United States,,20340,Technology,Radio And Television Broadcasting And Communications Equipment
DGX,Quest Diagnostics Incorporated Common Stock,$150.79,-1.34,-0.881%,16785521794.00,United States,,500806,Health Care,Medical Specialities
DH,Definitive Healthcare Corp. Class A Common Stock,$4.34,-0.01,-0.23%,508314306.00,United States,2021,262360,Technology,Computer Software: Prepackaged Software
DHAI,DIH Holdings US Inc. Class A Common Stock,$1.61,0.00,0.00%,65277345.00,United States,2024,13534,Health Care,Medical/Dental Instruments
DHAIW,DIH Holding US Inc. Warrants,$0.04,0.00,0.00%,1621797.00,United States,2024,1,Health Care,Medical/Dental Instruments
DHC,Diversified Healthcare Trust Common Shares of Beneficial Interest,$3.90,0.00,0.00%,938240983.00,United States,,469310,Real Estate,Real Estate Investment Trusts
DHCNI,Diversified Healthcare Trust 5.625% Senior Notes due 2042,$16.55,-0.08,-0.481%,3981509812.00,United States,,287833,Real Estate,Real Estate Investment Trusts
DHCNL,Diversified Healthcare Trust 6.25% Senior Notes Due 2046,$17.40,-0.045,-0.258%,4185998231.00,United States,,9517,Real Estate,Real Estate Investment Trusts
DHF,BNY Mellon High Yield Strategies Fund Common Stock,$2.61,0.00,0.00%,0.00,United States,1998,462554,Finance,Finance Companies
DHI,D.R. Horton Inc. Common Stock,$184.64,-5.57,-2.928%,60200043325.00,United States,,2542256,Consumer Discretionary,Homebuilding
DHIL,Diamond Hill Investment Group Inc. Class A Common Stock,$156.99,1.01,0.648%,431883101.00,United States,,10860,Finance,Investment Managers
DHR,Danaher Corporation Common Stock,$270.03,-0.49,-0.181%,195019198262.00,United States,,1132669,Industrials,Industrial Machinery/Components
DHT,DHT Holdings Inc.,$11.90,-0.14,-1.163%,1915894550.00,Jersey,2005,1727563,Consumer Discretionary,Marine Transportation
DHX,DHI Group Inc. Common Stock,$1.67,0.00,0.00%,80834453.00,United States,2007,131810,Consumer Discretionary,Business Services
DHY,Credit Suisse High Yield Bond Fund Common Stock,$2.22,0.02,0.909%,0.00,United States,1998,234002,Finance,Finance/Investors Services
DIAX,Nuveen Dow 30SM Dynamic Overwrite Fund Common Shares of Beneficial Interest,$14.78,0.10,0.681%,0.00,,2014,55455,Finance,Finance Companies
DIBS,1stdibs.com Inc. Common Stock,$4.50,0.07,1.58%,178619121.00,United States,2021,60236,Consumer Discretionary,Catalog/Specialty Distribution
DIN,Dine Brands Global Inc. Common Stock,$32.75,-0.80,-2.385%,501042741.00,United States,,1176305,Consumer Discretionary,Restaurants
DINO,HF Sinclair Corporation Common Stock,$46.74,-0.96,-2.013%,8918773212.00,United States,1960,2081045,Energy,Natural Gas Distribution
DIOD,Diodes Incorporated Common Stock,$64.60,1.95,3.113%,2993020133.00,United States,,402379,Technology,Semiconductors
DIS,Walt Disney Company (The) Common Stock,$95.15,1.52,1.623%,172562839207.00,United States,,6317333,Consumer Discretionary,Services-Misc. Amusement & Recreation
DIST,Distoken Acquisition Corporation Ordinary Shares,$10.87,0.00,0.00%,0.00,China,2023,5003,Finance,Blank Checks
DIT,AMCON Distributing Company Common Stock,$136.10,-3.90,-2.786%,85792268.00,United States,1999,27,Consumer Discretionary,Food Distributors
DJCO,Daily Journal Corp. (S.C.) Common Stock,$471.49,5.89,1.265%,649442585.00,United States,,9869,Consumer Discretionary,Newspapers/Magazines
DJT,Trump Media & Technology Group Corp. Common Stock,$16.50,0.33,2.041%,3212810238.00,United States,2024,9990344,Technology,Computer Software: Programming Data Processing
DJTWW,Trump Media & Technology Group Corp. Warrants,$11.41,0.03,0.264%,2221706959.00,United States,2021,105107,Technology,Computer Software: Programming Data Processing
DK,Delek US Holdings Inc. Common Stock,$20.26,-0.11,-0.54%,1307552543.00,United States,2017,1174942,Energy,Integrated oil Companies
DKL,Delek Logistics Partners L.P. Common Units representing Limited Partner Interests,$44.37,0.21,0.476%,2095592926.00,United States,2012,44424,Energy,Natural Gas Distribution
DKNG,DraftKings Inc. Class A Common Stock,$39.28,1.28,3.368%,19071634308.00,United States,2019,6757398,Consumer Discretionary,Services-Misc. Amusement & Recreation
DKS,Dick's Sporting Goods Inc Common Stock,$215.03,7.51,3.619%,17506177827.00,United States,2002,965987,Consumer Discretionary,Other Specialty Stores
DLB,Dolby Laboratories Common Stock,$75.71,0.09,0.119%,7218768537.00,United States,2005,203287,Miscellaneous,Multi-Sector Companies
DLHC,DLH Holdings Corp.,$8.86,0.03,0.34%,125660414.00,United States,,17630,Consumer Discretionary,Professional Services
DLNG,Dynagas LNG Partners LP Common Units,$3.88,0.02,0.518%,142930559.00,Greece,,13406,Consumer Discretionary,Marine Transportation
DLNG^A,Dynagas LNG Partners LP 9.00% Series A Cumulative Redeemable Preferred Units,$25.7061,0.00,0.00%,,Greece,,222,,
DLNG^B,Dynagas LNG Partners LP 8.75% Series B Fixed to Floating Rate Cumulative Redeemable Perpetual Preferred Units liquidation preference $25.00 per Uni,$26.04,-0.088,-0.337%,,Greece,,1975,,
DLO,DLocal Limited Class A Common Shares,$8.80,0.15,1.734%,2604726652.00,Uruguay,2021,999117,Consumer Discretionary,Business Services
