Symbol,Name,Last Sale,Net Change,% Change,Market Cap,Country,IPO Year,Volume,Sector,Industry
ISD,PGIM High Yield Bond Fund Inc.,$14.10,0.13,0.931%,0.00,United States,2012,141950,Finance,Trusts Except Educational Religious and Charitable
ISDR,Issuer Direct Corporation Common Stock,$10.50,-0.10,-0.943%,40256759.00,United States,,14246,Consumer Discretionary,Publishing
ISPC,iSpecimen Inc. Common Stock,$5.23,-0.01,-0.191%,3424876.00,United States,2021,86218,Health Care,Biotechnology: Commercial Physical & Biological Resarch
ISPO,Inspirato Incorporated Class A Common Stock,$3.85,-0.05,-1.282%,12839173.00,United States,2021,10185,Finance,Blank Checks
ISPR,Ispire Technology Inc. Common Stock,$6.25,-0.05,-0.794%,354006506.00,United States,2023,41025,Health Care, Medicinal Chemicals and Botanical Products 
ISRG,Intuitive Surgical Inc. Common Stock,$481.95,2.32,0.484%,171262945123.00,United States,2000,903893,Health Care,Industrial Specialties
ISRL,Israel Acquisitions Corp Class A Ordinary Shares,$11.22,0.05,0.448%,0.00,United States,2023,346,Finance,Blank Checks
ISRLW,Israel Acquisitions Corp Warrant,$0.03,0.005,20.00%,0.00,United States,2023,5426,Finance,Blank Checks
ISSC,Innovative Solutions and Support Inc. Common Stock,$6.64,0.36,5.732%,116199701.00,United States,2000,28670,Technology,EDP Services
ISTR,Investar Holding Corporation Common Stock,$18.91,0.52,2.828%,185864707.00,United States,2014,27265,Finance,Major Banks
IT,Gartner Inc. Common Stock,$513.71,5.42,1.066%,39586242937.00,United States,1993,271111,Consumer Discretionary,Other Consumer Services
ITCI,Intra-Cellular Therapies Inc. Common Stock,$72.89,0.64,0.886%,7702062163.00,United States,,264594,Health Care,Biotechnology: Pharmaceutical Preparations
ITGR,Integer Holdings Corporation Common Stock,$129.11,3.33,2.647%,4329210521.00,United States,,302874,Health Care,Biotechnology: Electromedical & Electrotherapeutic Apparatus
ITI,Iteris Inc. Common Stock,$7.16,0.00,0.00%,306611420.00,United States,,348210,Telecommunications,Telecommunications Equipment
ITIC,Investors Title Company Common Stock,$225.00,0.00,0.00%,423872325.00,United States,,11504,Finance,Specialty Insurers
ITOS,iTeos Therapeutics Inc. Common Stock,$10.02,0.335,3.459%,365948887.00,United States,2020,445192,Health Care,Biotechnology: Biological Products (No Diagnostic Substances)
ITP,IT Tech Packaging Inc. Common Stock,$0.275,0.005,1.852%,2768128.00,China,,159716,Consumer Discretionary,Containers/Packaging
ITRG,Integra Resources Corp. Common Shares,$1.01,0.0244,2.476%,89343289.00,,,103021,Basic Materials,Precious Metals
ITRI,Itron Inc. Common Stock,$104.93,1.34,1.294%,4717946499.00,United States,1993,187110,Industrials,Electrical Products
ITRM,Iterum Therapeutics plc Ordinary Share,$1.005,0.009,0.904%,22819524.00,Ireland,2018,123593,Health Care,Biotechnology: Pharmaceutical Preparations
ITRN,Ituran Location and Control Ltd. Ordinary Shares,$26.23,0.20,0.768%,521808603.00,Israel,2005,45013,Technology,Electronic Components
ITT,ITT Inc. Common Stock ,$148.21,1.67,1.14%,12108757000.00,United States,2011,195364,Industrials,Fluid Controls
ITUB,Itau Unibanco Banco Holding SA American Depositary Shares (Each repstg 500 Preferred shares),$6.44,0.06,0.94%,63117581290.00,Brazil,,17118513,Finance,Major Banks
ITW,Illinois Tool Works Inc. Common Stock,$258.41,-1.58,-0.608%,76721929000.00,United States,,624279,Industrials,Industrial Machinery/Components
IVA,Inventiva S.A. American Depository Shares,$1.8715,0.0465,2.548%,97534733.00,France,2020,14728,Health Care,Biotechnology: Pharmaceutical Preparations
IVAC,Intevac Inc. Common Stock,$3.36,-0.05,-1.466%,90502964.00,United States,1995,24462,Technology,Industrial Machinery/Components
IVCA,Investcorp India Acquisition Corp. Class A Ordinary Share,$11.53,0.00,0.00%,0.00,Cayman Islands,2022,47,Finance,Blank Checks
IVCAW,Investcorp India Acquisition Corp. Warrant,$0.06,0.00,0.00%,0.00,Cayman Islands,2022,6100,Finance,Blank Checks
IVCB,Investcorp Europe Acquisition Corp I Class A Ordinary Shares,$11.80,0.00,0.00%,0.00,Cayman Islands,2022,308842,Finance,Blank Checks
IVCBU,Investcorp Europe Acquisition Corp I Unit,$11.20,0.00,0.00%,0.00,Cayman Islands,2021,9,Finance,Blank Checks
IVDA,Iveda Solutions Inc. Common Stock,$1.56,-0.01,-0.637%,3523630.00,United States,,31859,Technology,Computer Software: Prepackaged Software
IVDAW,Iveda Solutions Inc. Warrant,$0.0186,0.0069,58.974%,42013.00,United States,,33419,Technology,Computer Software: Prepackaged Software
IVP,Inspire Veterinary Partners Inc. Class A Common Stock,$0.2656,-0.0144,-5.143%,951909.00,United States,2023,2076374,Consumer Staples,Farming/Seeds/Milling
IVR,INVESCO MORTGAGE CAPITAL INC Common Stock,$9.05,-0.05,-0.549%,496118149.00,United States,2009,3469822,Real Estate,Real Estate Investment Trusts
IVR^B,Invesco Mortgage Capital Inc. Preferred Series B Cum Fxd to Fltg,$24.92,-0.17,-0.678%,,United States,,3155,,
IVR^C,INVESCO MORTGAGE CAPITAL INC 7.5% Fixed-to-Floating Series C Cumulative Redeemable Preferred Stock Liquation Preference $25.00 per Share,$24.50,0.01,0.041%,,United States,,4978,,
IVT,InvenTrust Properties Corp. Common Stock,$29.47,0.24,0.821%,2001897100.00,United States,2021,529517,Real Estate,Real Estate Investment Trusts
IVVD,Invivyd Inc. Common Stock,$0.9505,-0.0101,-1.051%,113530225.00,United States,2021,256171,Health Care,Biotechnology: Biological Products (No Diagnostic Substances)
IVZ,Invesco Ltd Common Stock,$17.74,0.27,1.546%,7983575237.00,United States,,3215328,Finance,Investment Managers
IX,Orix Corp Ads Common Stock,$115.86,1.33,1.161%,28153077566.00,Japan,,12461,Finance,Diversified Financial Services
IXAQ,IX Acquisition Corp. Class A Ordinary Share,$11.59,-0.01,-0.086%,0.00,United Kingdom,2021,21416,Finance,Blank Checks
IXAQW,IX Acquisition Corp. Warrant,$0.0707,-0.0072,-9.243%,0.00,United Kingdom,2021,3400,Finance,Blank Checks
IXHL,Incannex Healthcare Inc. Common Stock,$1.64,0.01,0.613%,28934244.00,Australia,,2875,Health Care,Biotechnology: Pharmaceutical Preparations
IZEA,IZEA Worldwide Inc. Common Stock,$2.61,0.04,1.556%,42935607.00,United States,,16474,Consumer Discretionary,Advertising
IZM,ICZOOM Group Inc. Class A Ordinary Shares,$2.95,0.0787,2.741%,30591966.00,China,2023,149603,Consumer Discretionary,Consumer Electronics/Video Chains
J,Jacobs Solutions Inc. Common Stock,$140.04,1.13,0.813%,17399735713.00,United States,2022,961133,Industrials,Military/Government/Technical
JACK,Jack In The Box Inc. Common Stock,$45.15,-0.31,-0.682%,863538042.00,United States,,735740,Consumer Discretionary,Restaurants
JAGX,Jaguar Health Inc. Common Stock,$1.28,-0.03,-2.29%,11828776.00,United States,2015,243132,Health Care,Biotechnology: Pharmaceutical Preparations
JAKK,JAKKS Pacific Inc. Common Stock,$25.62,0.87,3.515%,281411617.00,United States,1996,36197,Consumer Discretionary,Recreational Games/Products/Toys
JAMF,Jamf Holding Corp. Common Stock,$17.27,0.56,3.351%,2204366771.00,United States,2020,272879,Technology,Computer Software: Prepackaged Software
JANX,Janux Therapeutics Inc. Common Stock,$45.02,0.85,1.924%,2348445700.00,United States,2021,412782,Health Care,Biotechnology: Pharmaceutical Preparations
JAZZ,Jazz Pharmaceuticals plc Common Stock (Ireland),$109.38,0.82,0.755%,6754598924.00,Ireland,2007,330587,Health Care,Biotechnology: Pharmaceutical Preparations
JBDI,JBDI Holdings Limited Ordinary Shares,$1.17,0.273,30.435%,23151375.00,Singapore,2024,23367251,,
JBGS,JBG SMITH Properties Common Shares ,$17.68,0.02,0.113%,1529489887.00,United States,2017,317882,Real Estate,Real Estate Investment Trusts
JBHT,J.B. Hunt Transport Services Inc. Common Stock,$164.52,-2.21,-1.325%,16778824080.00,United States,,642724,Industrials,Trucking Freight/Courier Services
JBI,Janus International Group Inc. Common Stock,$9.79,0.18,1.873%,1422704612.00,United States,2021,1675210,Industrials,Building Products
JBL,Jabil Inc. Common Stock,$121.66,1.76,1.468%,13801742059.00,United States,1993,1043352,Technology,Electrical Products
JBLU,JetBlue Airways Corporation Common Stock,$7.30,0.91,14.241%,2531881827.00,United States,2002,45220127,Consumer Discretionary,Air Freight/Delivery Services
JBSS,John B. Sanfilippo & Son Inc. Common Stock,$93.38,0.55,0.592%,1083531468.00,United States,1991,32287,Consumer Staples,Specialty Foods
JBT,John Bean Technologies Corporation Common Stock,$99.93,2.17,2.22%,3181830658.00,United States,,282986,Industrials,Industrial Machinery/Components
JCE,Nuveen Core Equity Alpha Fund Common Shares of Beneficial Interest,$15.14,0.12,0.799%,0.00,United States,2007,35770,Finance,Trusts Except Educational Religious and Charitable
JCI,Johnson Controls International plc Ordinary Share,$75.68,0.19,0.252%,50555265388.00,Switzerland,,2436050,Industrials,Industrial Machinery/Components
JCSE,JE Cleantech Holdings Limited Ordinary Shares,$1.34,-0.01,-0.741%,6708932.00,Singapore,2022,12351,Consumer Discretionary,Miscellaneous manufacturing industries
JCTCF,Jewett-Cameron Trading Company Common Shares,$4.94,0.00,0.00%,17313722.00,United States,,539,Consumer Discretionary,RETAIL: Building Materials
JD,JD.com Inc. American Depositary Shares,$46.97,2.37,5.314%,73842386405.00,China,2014,30072361,Consumer Discretionary,Other Specialty Stores
JDZG,JIADE LIMITED Common stock,$0.6452,0.0001,0.016%,15636726.00,China,2024,77886,Real Estate,Other Consumer Services
JEF,Jefferies Financial Group Inc. Common Stock,$63.34,0.81,1.295%,13015779861.00,United States,,1110901,Finance,Investment Bankers/Brokers/Service
JELD,JELD-WEN Holding Inc. Common Stock,$16.00,-0.03,-0.187%,1352682176.00,United States,2017,461390,Basic Materials,Forest Products
JEQ,abrdn Japan Equity Fund Inc. Common Stock,$6.265,0.075,1.212%,85203937.00,United States,1992,14008,Consumer Discretionary,Air Freight/Delivery Services
JFBR,Jeffs' Brands Ltd Ordinary Shares,$0.2521,0.0077,3.151%,2314278.00,Israel,2022,241175,Consumer Discretionary,Other Specialty Stores
JFIN,Jiayin Group Inc. American Depositary Shares,$7.62,-0.50,-6.158%,404107543.00,China,2019,382468,Finance,Finance: Consumer Services
JFR,Nuveen Floating Rate Income Fund Common Stock,$8.92,0.08,0.905%,0.00,United States,2004,418331,Finance,Trusts Except Educational Religious and Charitable
JFU,9F Inc. American Depositary Shares,$2.79,0.44,18.723%,32847599.00,China,2019,226423,Finance,Finance: Consumer Services
JG,Aurora Mobile Limited American Depositary Shares,$9.40,1.57,20.051%,56216794.00,China,2018,83012,Technology,Computer Software: Programming Data Processing
JGH,Nuveen Global High Income Fund Common Shares of Beneficial Interest,$13.37,0.07,0.526%,0.00,United States,2014,49790,Finance,Investment Managers
JHG,Janus Henderson Group plc Ordinary Shares,$38.94,1.29,3.426%,6201740277.00,United Kingdom,2017,1067648,Finance,Investment Managers
JHI,John Hancock Investors Trust Common Stock,$14.10,-0.0225,-0.159%,123298113.00,United States,,78691,Finance,Trusts Except Educational Religious and Charitable
JHS,John Hancock Income Securities Trust Common Stock,$11.57,-0.05,-0.43%,134750988.00,United States,,25589,Finance,Finance Companies
JHX,James Hardie Industries plc American Depositary Shares (Ireland),$37.74,-0.39,-1.023%,16371032087.00,Ireland,,25200,Industrials,Building Materials
JILL,J. Jill Inc. Common Stock,$24.54,0.48,1.995%,370170096.00,United States,2017,90216,Consumer Discretionary,Apparel
JJSF,J & J Snack Foods Corp. Common Stock,$170.23,1.55,0.919%,3306500026.00,United States,1986,31360,Consumer Staples,Specialty Foods
JKHY,Jack Henry & Associates Inc. Common Stock,$182.14,-1.44,-0.784%,13279521223.00,United States,1985,526979,Technology,EDP Services
JKS,JinkoSolar Holding Company Limited American Depositary Shares (each representing 4 Common Shares),$29.94,3.85,14.757%,1646719551.00,China,2010,2983059,Technology,Semiconductors
JL,J-Long Group Limited Ordinary Shares,$0.4095,-0.0154,-3.624%,12858300.00,Hong Kong,2024,168185,Consumer Discretionary,Clothing/Shoe/Accessory Stores
JLL,Jones Lang LaSalle Incorporated Common Stock,$260.86,-3.83,-1.447%,12381520342.00,United States,,224975,Finance,Real Estate
JLS,Nuveen Mortgage and Income Fund,$18.57,-0.06,-0.322%,0.00,United States,2009,24996,Finance,Investment Managers
JMIA,Jumia Technologies AG American Depositary Shares each representing two Ordinary Shares,$5.87,0.31,5.576%,718840200.00,,2019,3562835,Consumer Discretionary,Catalog/Specialty Distribution
JMM,Nuveen Multi-Market Income Fund (MA),$6.41,0.01,0.156%,0.00,United States,,1306,Finance,Trusts Except Educational Religious and Charitable
JMSB,John Marshall Bancorp Inc. Common Stock,$19.45,0.64,3.402%,276794953.00,United States,,10433,Finance,Major Banks
JNJ,Johnson & Johnson Common Stock,$160.29,-0.21,-0.131%,385857087383.00,United States,,5331694,Health Care,Biotechnology: Pharmaceutical Preparations
JNPR,Juniper Networks Inc. Common Stock,$38.82,-0.03,-0.077%,12778126216.00,United States,1999,3628291,Telecommunications,Computer Communications Equipment
JNVR,Janover Inc. Common Stock,$0.5501,-0.0119,-2.117%,6151341.00,United States,2023,12981,Finance,Finance: Consumer Services
JOB,GEE Group Inc. Common Stock,$0.255,-0.0013,-0.507%,27736752.00,United States,1968,195209,Consumer Discretionary,Diversified Commercial Services
JOBY,Joby Aviation Inc. Common Stock,$5.95,0.34,6.061%,4261048928.00,United States,2020,18240520,Industrials,Aerospace
JOE,St. Joe Company (The) Common Stock,$58.55,0.95,1.649%,3419173976.00,United States,,135265,Real Estate,Homebuilding
JOF,Japan Smaller Capitalization Fund Inc Common Stock,$8.16,0.005,0.061%,0.00,United States,1990,57459,Finance,Trusts Except Educational Religious and Charitable
JOUT,Johnson Outdoors Inc. Class A Common Stock,$34.65,-0.22,-0.631%,357047183.00,United States,,36031,Consumer Discretionary,Recreational Games/Products/Toys
JPC,Nuveen Preferred & Income Opportunities Fund,$7.99,-0.04,-0.498%,0.00,United States,2003,1241645,Finance,Investment Managers
JPI,Nuveen Preferred Securities & Income Opportunities Fund Common Shares,$21.35,-0.038,-0.178%,486191146.00,,2012,32010,Finance,Finance Companies
JPM,JP Morgan Chase & Co. Common Stock,$211.22,5.99,2.919%,600955693637.00,United States,,10213415,Finance,Major Banks
JPM^C,J P Morgan Chase & Co Depositary Shares each representing a 1/400th interest in a share of 6.00% Non-Cumulative  Preferred Stock Series EE,$25.63,-0.06,-0.234%,,United States,,69716,,
JPM^D,J P Morgan Chase & Co Depositary Shares each representing a 1/400th  interest in a share of 5.75% Non-Cumulative  Preferred Stock Series DD,$25.35,-0.11,-0.432%,,United States,,45279,,
JPM^J,J P Morgan Chase & Co Depositary Shares each representing a 1/400th interest in a share of JPMorgan Chase & Co. 4.75% Non-Cumulative Preferred Stock Series GG,$23.70,-0.18,-0.754%,,United States,,176400,,
JPM^K,J P Morgan Chase & Co Depositary Shares each representing a 1/400th interest in a share of 4.55% Non-Cumulative Preferred Stock Series JJ,$22.58,-0.17,-0.747%,,United States,,136085,,
JPM^L,J P Morgan Chase & Co Depositary Shares each representing a 1/400th interest in a share of 4.625% Non-Cumulative Preferred Stock Series LL,$22.94,-0.16,-0.693%,,United States,,214226,,
JPM^M,J P Morgan Chase & Co Depositary Shares each representing a 1/400th interest in a share of 4.20% Non-Cumulative Preferred Stock Series MM,$21.15,-0.18,-0.844%,,United States,,150756,,
JQC,Nuveen Credit Strategies Income Fund Shares of Beneficial Interest,$5.72,0.06,1.06%,0.00,United States,2003,747777,Finance,Finance Companies
JRI,Nuveen Real Asset Income and Growth Fund Common Shares of Beneficial Interest,$13.28,-0.02,-0.15%,0.00,United States,2012,147827,Finance,Finance Companies
JRS,Nuveen Real Estate Income Fund Common Shares of Beneficial Interest,$8.91,-0.04,-0.447%,0.00,United States,2001,72733,Finance,Finance/Investors Services
JRSH,Jerash Holdings (US) Inc. Common Stock,$2.99,0.00,0.00%,36761572.00,United States,2018,4233,Consumer Discretionary,Apparel
JRVR,James River Group Holdings Ltd. Common Shares,$6.59,0.34,5.44%,249271805.00,Bermuda,2014,347908,Finance,Property-Casualty Insurers
JSM,Navient Corporation 6% Senior Notes due December 15 2043,$20.62,-0.0001,0.00%,2256036138.00,United States,,5878,Finance,Finance: Consumer Services
JSPR,Jasper Therapeutics Inc. Common Stock,$16.08,-0.29,-1.772%,242893224.00,United States,2020,109402,Health Care,Biotechnology: Biological Products (No Diagnostic Substances)
JSPRW,Japer Therapeutics Inc. Warrants,$0.205,0.0025,1.235%,3096587.00,United States,2020,1844,Health Care,Biotechnology: Biological Products (No Diagnostic Substances)
JTAI,Jet.AI Inc. Common Stock,$0.085,-0.0074,-8.009%,2089035.00,United States,2021,1697209,Consumer Discretionary,Transportation Services
JUNE,Junee Limited Ordinary Shares,$4.60,-0.1601,-3.363%,58485716.00,Hong Kong,2024,27105,,
JVA,Coffee Holding Co. Inc. Common Stock,$3.01,0.04,1.347%,17182883.00,United States,2005,45080,Consumer Staples,Packaged Foods
JVSA,JV SPAC Acquisition Corp. Class A Ordinary Share,$10.33,0.00,0.00%,0.00,China,2024,8232,,
JVSAU,JVSPAC Acquisition Corp. Unit,$10.772,0.132,1.241%,0.00,China,2024,1500,,
JWEL,Jowell Global Ltd. Ordinary Shares,$1.71,-0.01,-0.581%,3711512.00,China,2021,18317,Consumer Discretionary,Other Consumer Services
JWN,Nordstrom Inc. Common Stock,$21.97,0.50,2.329%,3607715428.00,United States,,1731603,Consumer Discretionary,Clothing/Shoe/Accessory Stores
JWSM,Jaws Mustang Acquisition Corp. Class A Ordinary Shares,$11.30,0.00,0.00%,0.00,,2021,1399,Finance,Blank Checks
JXJT,JX Luxventure Limited Common Stock,$1.83,0.0017,0.093%,11095641.00,China,2013,7843,Consumer Staples,Apparel
JXN,Jackson Financial Inc. Class A Common Stock ,$96.55,4.30,4.661%,7264520095.00,United States,2021,461559,Finance,Life Insurance
JXN^A,Jackson Financial Inc. Depositary Shares each representing a 1/1000th interest in a share of Fixed-Rate Reset Noncumulative Perpetual Preferred Stock Series A,$27.03,0.03,0.111%,,United States,,39151,,
JYD,Jayud Global Logistics Limited Class A Ordinary Shares,$0.84,-0.0301,-3.459%,17935867.00,China,2023,32485,Consumer Discretionary,Oil Refining/Marketing
JYNT,The Joint Corp. Common Stock,$11.12,0.15,1.367%,166764138.00,United States,2014,35905,Miscellaneous,Multi-Sector Companies
JZ,Jianzhi Education Technology Group Company Limited American Depositary Shs,$1.06,-0.08,-7.018%,21396100.00,China,2022,14396,Real Estate,Other Consumer Services
JZXN,Jiuzi Holdings Inc. Ordinary Shares,$1.44,-0.1401,-8.867%,13037757.00,China,2021,15404,Consumer Discretionary,Retail-Auto Dealers and Gas Stations
K,Kellanova Common Stock,$80.61,-0.02,-0.025%,27591819155.00,United States,,1198123,Consumer Staples,Packaged Foods
KACL,Kairous Acquisition Corp. Limited Ordinary Shares,$12.34,0.06,0.489%,0.00,Malaysia,2022,455,Finance,Blank Checks
KACLR,Kairous Acquisition Corp. Limited Rights,$0.082,-0.023,-21.905%,0.00,Malaysia,2022,1987,Finance,Blank Checks
KACLW,Kairous Acquisition Corp. Limited Warrants,$0.0285,-0.008,-21.918%,0.00,Malaysia,2022,1792,Finance,Blank Checks
KAI,Kadant Inc Common Stock,$326.27,4.86,1.512%,3831898896.00,United States,1992,53580,Industrials,Industrial Machinery/Components
KALA,KALA BIO Inc. Common Stock,$5.40,0.10,1.887%,24880873.00,United States,2017,9210,Health Care,Biotechnology: Pharmaceutical Preparations
KALU,Kaiser Aluminum Corporation Common Stock,$71.80,1.31,1.858%,1155054642.00,United States,,74589,Industrials,Metal Fabrications
KALV,KalVista Pharmaceuticals Inc. Common Stock,$11.36,-0.18,-1.56%,490927762.00,United Kingdom,2015,448251,Health Care,Biotechnology: Pharmaceutical Preparations
KAPA,Kairos Pharma Ltd. Common Stock,$1.325,-0.035,-2.574%,17015567.00,,2024,48304,Health Care,Biotechnology: Pharmaceutical Preparations
KAR,OPENLANE Inc. Common Stock,$16.22,0.17,1.059%,1761805792.00,United States,2009,558811,Consumer Discretionary,Retail-Auto Dealers and Gas Stations
KARO,Karooooo Ltd. Ordinary Shares,$39.50,0.9769,2.536%,1220550000.00,Singapore,2021,24822,Technology,Computer Software: Prepackaged Software
KAVL,Kaival Brands Innovations Group Inc. Common Stock,$1.05,-0.06,-5.405%,7123156.00,United States,,231163,Consumer Discretionary,Other Consumer Services
KB,KB Financial Group Inc,$61.67,0.96,1.581%,23352198088.00,South Korea,,96014,Finance,Commercial Banks
KBDC,Kayne Anderson BDC Inc. Common Stock,$15.98,-0.04,-0.25%,0.00,,2024,24985,,
KBH,KB Home Common Stock,$81.77,-1.83,-2.189%,6149412191.00,United States,1986,1269696,Consumer Discretionary,Homebuilding
KBR,KBR Inc. Common Stock,$68.25,1.89,2.848%,9080674785.00,United States,2006,983351,Industrials,Military/Government/Technical
KC,Kingsoft Cloud Holdings Limited American Depositary Shares,$3.90,0.07,1.828%,989374047.00,China,2020,3630049,Technology,Computer Software: Prepackaged Software
KD,Kyndryl Holdings Inc. Common Stock,$23.63,0.53,2.294%,5463432847.00,United States,2021,1361343,Technology,EDP Services
KDLY,Kindly MD Inc. Common Stock,$1.033,0.0131,1.284%,6143426.00,United States,2024,23087,Health Care,Medical/Nursing Services
KDLYW,Kindly MD Inc. Warrants,$0.259,0.01,4.016%,1540317.00,United States,2024,714,Health Care,Medical/Nursing Services
KDP,Keurig Dr Pepper Inc. Common Stock,$36.39,-0.25,-0.682%,49347983259.00,United States,,9473617,Consumer Staples,Beverages (Production/Distribution)
KE,Kimball Electronics Inc. Common Stock,$17.51,0.18,1.039%,433081099.00,United States,,113371,Technology,Electrical Products
KELYA,Kelly Services Inc. Class A Common Stock,$20.60,-0.06,-0.29%,732707928.00,United States,,104748,Consumer Discretionary,Professional Services
KELYB,Kelly Services Inc. Class B Common Stock,$20.70,-0.30,-1.429%,736264762.00,United States,,365,Consumer Discretionary,Professional Services
KEN,Kenon Holdings Ltd. Ordinary Shares,$26.86,-0.20,-0.739%,1417290597.00,Singapore,2015,9333,Utilities,Electric Utilities: Central
KEP,Korea Electric Power Corporation Common Stock,$7.51,0.02,0.267%,9642300437.00,South Korea,1994,51119,Utilities,Electric Utilities: Central
KEQU,Kewaunee Scientific Corporation Common Stock,$31.64,0.61,1.966%,90864005.00,United States,,19941,Industrials,Medical Specialities
KEX,Kirby Corporation Common Stock,$123.23,2.22,1.835%,7135017000.00,United States,,291169,Consumer Discretionary,Marine Transportation
KEY,KeyCorp Common Stock,$16.78,0.41,2.505%,15826824400.00,United States,,9477952,Finance,Major Banks
KEY^I,KeyCorp Depositary Shares Each Representing a 1/40th Ownership Interest in a Share of Fixed-to-Floating Rate Perpetual Non-Cumulative Preferred Stock Series E,$24.78,-0.02,-0.081%,,United States,,40051,,
KEY^J,KeyCorp Depositary Shares each representing a 1/40th ownership interest in a share of Fixed Rate Perpetual Non-Cumulative Preferred Stock Series F,$23.0154,0.0154,0.067%,,United States,,24600,,
KEY^K,KeyCorp Depositary Shares each representing a 1/40th ownership interest in a share of Fixed Rate Perpetual Non-Cumulative Preferred Stock Series G,$23.36,0.01,0.043%,,United States,,17537,,
KEY^L,KeyCorp Depositary Shares each representing a 1/40th ownership interest in a share of Fixed Rate Perpetual Non-Cumulative Preferred Stock Series H,$24.63,0.03,0.122%,,United States,,66332,,
KEYS,Keysight Technologies Inc. Common Stock,$156.38,1.81,1.171%,27138709855.00,United States,2014,667589,Industrials,Industrial Machinery/Components
KF,Korea Fund Inc. (The) New Common Stock,$22.58,0.06,0.266%,0.00,United States,,16819,Finance,Investment Managers
KFFB,Kentucky First Federal Bancorp Common Stock,$3.3331,0.1531,4.814%,26953830.00,United States,2005,9294,Finance,Savings Institutions
KFRC,Kforce Inc. Common Stock,$57.03,-0.04,-0.07%,1105184370.00,United States,1995,184156,Consumer Discretionary,Professional Services
KFS,Kingsway Financial Services Inc. Common Stock (DE),$8.22,-0.10,-1.202%,228605787.00,Canada,,16692,Finance,Property-Casualty Insurers
KFY,Korn Ferry Common Stock,$72.90,0.83,1.152%,3791575948.00,United States,1999,188523,Consumer Discretionary,Diversified Commercial Services
KGC,Kinross Gold Corporation Common Stock,$9.42,-0.11,-1.154%,11577180000.00,Canada,2001,13039027,Basic Materials,Precious Metals
KGEI,Kolibri Global Energy Inc. Common stock,$3.1501,-0.1199,-3.667%,112571863.00,United States,,3562,Energy,Oil & Gas Production
KGS,Kodiak Gas Services Inc. Common Stock,$32.50,1.94,6.348%,2746562390.00,United States,2023,1296524,Utilities,Natural Gas Distribution
KHC,The Kraft Heinz Company Common Stock,$34.59,0.42,1.229%,41822039047.00,United States,,4808768,Consumer Staples,Packaged Foods
KIDS,OrthoPediatrics Corp. Common Stock,$25.93,0.29,1.131%,627880066.00,United States,2017,94882,Health Care,Medical/Dental Instruments
KIM,Kimco Realty Corporation (HC) Common Stock,$22.94,0.07,0.306%,15464133088.00,United States,,2791059,Real Estate,Real Estate Investment Trusts
KIM^L,Kimco Realty Corporation Class L Depositary Shares each of which represents a one-one thousandth fractional interest in a share of 5.125% Class L Cumulative Redeemable Preferred Stock liquidation preference $25000.00 per share,$23.50,-0.09,-0.382%,,United States,,17227,,
KIM^M,Kimco Realty Corporation Class M Depositary Shares each of which represents a one-one thousandth fractional interest in a share of 5.25% Class M Cumulative Redeemable Preferred Stock liquidation preference $25000.00 per share,$24.26,-0.10,-0.411%,,United States,,13461,,
KIM^N,Kimco Realty Corporation Depositary Shares each representing 1/1000th interest in a share of 7.25% Class N Cumulative Convertible Perpetual Preferred Stock,$60.20,0.33,0.551%,,United States,,840,,
KIND,Nextdoor Holdings Inc. Class A Common Stock,$2.50,0.11,4.603%,949771030.00,United States,,878840,Technology,Computer Software: Programming Data Processing
KINS,Kingstone Companies Inc. Common Stock,$8.99,0.07,0.785%,99471860.00,United States,,69260,Finance,Property-Casualty Insurers
KIO,KKR Income Opportunities Fund Common Shares,$14.77,0.06,0.408%,0.00,United States,2013,91175,Finance,Investment Managers
