Symbol,Name,Last Sale,Net Change,% Change,Market Cap,Country,IPO Year,Volume,Sector,Industry
QLGN,Qualigen Therapeutics Inc. Common Stock,$0.1655,0.0055,3.438%,2011790.00,United States,2015,42796,Health Care,Biotechnology: Pharmaceutical Preparations
QLYS,Qualys Inc. Common Stock,$127.13,1.28,1.017%,4679784718.00,United States,2012,253004,Technology,Computer Software: Prepackaged Software
QMCO,Quantum Corporation Common Stock,$3.471,0.081,2.389%,16635427.00,United States,,7011,Technology,Electronic Components
QMMM,QMMM Holdings Limited Ordinary Shares,$7.50,0.78,11.607%,128437500.00,Hong Kong,2024,1267386,Consumer Discretionary,Advertising
QNCX,Quince Therapeutics Inc. Common Stock,$0.7885,0.0385,5.133%,34123604.00,United States,2019,9754,Health Care,Biotechnology: Biological Products (No Diagnostic Substances)
QNRX,Quoin Pharmaceuticals Ltd. American Depositary Shares,$0.4839,-0.0035,-0.718%,1925907.00,Israel,2016,32633,Health Care,Medical/Dental Instruments
QNST,QuinStreet Inc. Common Stock,$19.13,0.46,2.464%,1070822678.00,United States,2010,243126,Consumer Discretionary,Business Services
QNTM,Quantum Biopharma Ltd. Class B Subordinate Voting Shares,$4.60,0.6781,17.29%,5982208.00,Canada,,246242,Health Care,Biotechnology: Pharmaceutical Preparations
QQQX,Nuveen NASDAQ 100 Dynamic Overwrite Fund Shares of Beneficial Interest,$25.03,0.06,0.24%,0.00,United States,,98240,Finance,Finance Companies
QRHC,Quest Resource Holding Corporation Common Stock,$8.10,0.15,1.887%,165105969.00,United States,,30703,Utilities,Environmental Services
QRTEA,Qurate Retail Inc. Series A Common Stock ,$0.6813,0.0902,15.26%,270422649.00,United States,,4565559,Consumer Discretionary,Catalog/Specialty Distribution
QRTEB,Qurate Retail Inc. Series B Common Stock ,$4.02,0.20,5.236%,1595624615.00,United States,,1516,Consumer Discretionary,Catalog/Specialty Distribution
QRTEP,Qurate Retail Inc. 8.0% Fixed Rate Cumulative Redeemable Preferred Stock,$41.51,-0.49,-1.167%,16476213374.00,United States,,28861,Consumer Discretionary,Catalog/Specialty Distribution
QRVO,Qorvo Inc. Common Stock,$102.00,0.32,0.315%,9675857292.00,United States,,978277,Technology,Semiconductors
QS,QuantumScape Corporation Class A Common Stock,$5.64,0.15,2.732%,2854480552.00,United States,2020,3056211,Miscellaneous,Industrial Machinery/Components
QSG,QuantaSing Group Limited American Depositary Shares,$3.72,0.54,16.981%,190140371.00,China,2023,401283,Real Estate,Other Consumer Services
QSI,Quantum-Si Incorporated Class A Common Stock,$0.88,0.043,5.137%,125277946.00,United States,2020,299201,Industrials,Industrial Machinery/Components
QSR,Restaurant Brands International Inc. Common Shares,$71.76,0.84,1.184%,32335178207.00,Canada,2014,1048228,Consumer Discretionary,Restaurants
QTI,QT Imaging Holdings Inc. Common Stock,$0.6283,-0.0059,-0.93%,13471642.00,United States,,83140,Health Care,Biotechnology: Electromedical & Electrotherapeutic Apparatus
QTRX,Quanterix Corporation Common Stock,$11.90,0.01,0.084%,456710493.00,United States,2017,358062,Industrials,Biotechnology: Laboratory Analytical Instruments
QTTB,Q32 Bio Inc. Common Stock,$44.75,2.00,4.678%,539675424.00,United States,2018,47422,Health Care,Biotechnology: Pharmaceutical Preparations
QTWO,Q2 Holdings Inc. Common Stock,$79.59,1.78,2.288%,4797937659.00,United States,2014,368848,Technology,Computer Software: Prepackaged Software
QUAD,Quad Graphics Inc Class A Common Stock,$4.97,0.08,1.636%,259240468.00,United States,,252975,Consumer Discretionary,Publishing
QUBT,Quantum Computing Inc. Common Stock,$0.6994,0.0329,4.936%,63886791.00,United States,,343144,Technology,Computer Software: Prepackaged Software
QUIK,QuickLogic Corporation Common Stock,$7.97,0.31,4.047%,115290904.00,United States,1999,97396,Technology,Semiconductors
QURE,uniQure N.V. Ordinary Shares,$5.65,1.09,23.904%,275141547.00,Netherlands,2014,2093072,Health Care,Biotechnology: Pharmaceutical Preparations
QVCC,QVC Inc. 6.250% Senior Secured Notes due 2068,$13.41,0.2011,1.522%,13.00,United States,2019,23591,Consumer Discretionary,Catalog/Specialty Distribution
QVCD,QVC Inc. 6.375% Senior Secured Notes due 2067,$13.4649,0.185,1.393%,13.00,United States,2018,13883,Consumer Discretionary,Catalog/Specialty Distribution
QXO,QXO Inc. Common Stock,$13.98,0.03,0.215%,5723834126.00,United States,,1734501,Technology,EDP Services
R,Ryder System Inc. Common Stock,$143.68,1.38,0.97%,6218927733.00,United States,,132126,Consumer Discretionary,Rental/Leasing Companies
RA,Brookfield Real Assets Income Fund Inc. Common Stock,$13.65,0.00,0.00%,0.00,United States,2016,163272,Finance,Investment Managers
RACE,Ferrari N.V. Common Shares,$449.81,-0.28,-0.062%,109641620217.00,Italy,2015,289954,Consumer Discretionary,Auto Manufacturing
RAIL,FreightCar America Inc. Common Stock,$12.525,0.485,4.028%,236394971.00,United States,2005,731500,Industrials,Railroads
RAMP,LiveRamp Holdings Inc. Common Stock,$24.49,0.56,2.34%,1631319211.00,United States,2018,595778,Technology,EDP Services
RAND,Rand Capital Corporation Common Stock,$16.8948,0.0134,0.079%,43605834.00,United States,,802,Finance,Finance: Consumer Services
RANI,Rani Therapeutics Holdings Inc. Class A Common Stock,$2.34,0.04,1.739%,124971229.00,United States,2021,39112,Health Care,Biotechnology: Pharmaceutical Preparations
RAPP,Rapport Therapeutics Inc. Common Stock,$20.80,2.46,13.413%,760790306.00,United States,2024,119330,Health Care,Biotechnology: Pharmaceutical Preparations
RAPT,RAPT Therapeutics Inc. Common Stock,$2.00,0.01,0.503%,69806952.00,United States,2019,160452,Health Care,Biotechnology: Pharmaceutical Preparations
RARE,Ultragenyx Pharmaceutical Inc. Common Stock,$53.79,0.13,0.242%,4957565570.00,United States,2014,778970,Health Care,Biotechnology: Pharmaceutical Preparations
RAVE,Rave Restaurant Group Inc. Common Stock,$2.495,0.155,6.624%,36393482.00,United States,,99250,Consumer Discretionary,Food Distributors
RAY,Raytech Holding Limited Ordinary Shares,$1.74,0.03,1.754%,30646764.00,Hong Kong,2024,30569,Consumer Discretionary,Consumer Electronics/Appliances
RAYA,Erayak Power Solution Group Inc. Class A Ordinary Shares,$0.7072,-0.0328,-4.432%,8804640.00,China,2022,10149,Consumer Discretionary,Metal Fabrications
RBA,RB Global Inc. Common Stock,$81.21,1.12,1.398%,14963267746.00,Canada,,902070,Consumer Discretionary,Business Services
RBB,RBB Bancorp Common Stock,$22.51,0.33,1.488%,400785778.00,United States,2017,21898,Finance,Major Banks
RBBN,Ribbon Communications Inc. Common Stock,$3.28,0.15,4.792%,572447235.00,United States,,235320,Technology,EDP Services
RBC,RBC Bearings Incorporated Common Stock,$292.48,0.94,0.322%,8549150330.00,United States,2022,127732,Industrials,Metal Fabrications
RBCAA,Republic Bancorp Inc. Class A Common Stock,$62.87,1.60,2.611%,1221820295.00,United States,1998,12855,Finance,Major Banks
RBCP,RBC Bearings Incorporated 5.00% Series A Mandatory Convertible Preferred Stock,$129.56,0.71,0.551%,3787021050.00,United States,2022,3729,Industrials,Metal Fabrications
RBKB,Rhinebeck Bancorp Inc. Common Stock,$9.6101,0.4301,4.685%,106553012.00,United States,2019,26129,Finance,Banks
RBLX,Roblox Corporation Class A Common Stock,$41.99,-0.19,-0.45%,27175928000.00,United States,2021,8199502,Technology,Computer Software: Prepackaged Software
RBOT,Vicarious Surgical Inc. Class A Common Stock,$5.71,0.06,1.062%,33673600.00,Hong Kong,2020,7204,Health Care,Industrial Specialties
RBRK,Rubrik Inc. Class A Common Stock,$33.19,0.59,1.81%,6029070073.00,United States,2024,2560077,Technology,Computer Software: Prepackaged Software
RC,Ready Capital Corproation Common Stock,$7.31,-0.07,-0.949%,1229650473.00,United States,2013,2053019,Real Estate,Real Estate Investment Trusts
RC^C,Ready Capital Corporation 6.25% Series C Cumulative Convertible Preferred Stock,$19.45,0.13,0.673%,,United States,,932,,
RC^E,Ready Capital Corporation 6.50% Series E Cumulative Redeemable Preferred Stock,$19.2701,-0.0199,-0.103%,,United States,,3037,,
RCAT,Red Cat Holdings Inc. Common Stock,$3.30,0.01,0.304%,248849825.00,United States,,1253337,Technology,Computer Software: Prepackaged Software
RCB,Ready Capital Corporation 6.20% Senior Notes due 2026,$24.38,-0.14,-0.571%,4101077775.00,United States,2019,7789,Real Estate,Real Estate Investment Trusts
RCC,Ready Capital Corporation 5.75% Senior Notes due 2026,$24.64,0.23,0.942%,4144813633.00,United States,2021,1206,Real Estate,Real Estate Investment Trusts
RCEL,Avita Medical Inc. Common Stock,$10.82,0.03,0.278%,281208543.00,United States,,90104,Health Care,Medical/Dental Instruments
RCFA,Perception Capital Corp. IV Class A Ordinary Shares,$11.455,0.00,0.00%,0.00,,2021,7,Finance,Blank Checks
RCG,RENN Fund Inc Common Stock,$2.10,0.03,1.449%,0.00,United States,,7809,Finance,Investment Managers
RCI,Rogers Communication Inc. Common Stock,$39.01,0.17,0.438%,20724630837.00,Canada,,679140,Telecommunications,Cable & Other Pay Television Services
RCKT,Rocket Pharmaceuticals Inc. Common Stock,$16.41,0.35,2.179%,1492913846.00,United States,2015,1274903,Health Care,Biotechnology: Pharmaceutical Preparations
RCKTW,Rocket Pharmaceuticals Inc. Warrant,$0.0797,0.0027,3.506%,7250776.00,United States,,1700,Health Care,Biotechnology: Pharmaceutical Preparations
RCKY,Rocky Brands Inc. Common Stock,$30.69,0.93,3.125%,228610424.00,United States,1993,21677,Consumer Discretionary,Shoe Manufacturing
RCL,Royal Caribbean Cruises Ltd. Common Stock,$179.44,6.28,3.627%,46191505989.00,United States,1993,1435726,Consumer Discretionary,Marine Transportation
RCM,R1 RCM Inc. Common Stock,$14.19,0.01,0.071%,5989726185.00,United States,,6696301,Consumer Discretionary,Other Consumer Services
RCMT,RCM Technologies Inc. Common Stock,$20.39,0.39,1.95%,155554658.00,United States,,32879,Consumer Discretionary,Professional Services
RCON,Recon Technology Ltd. Class A Ordinary Shares,$3.08,0.13,4.407%,46132104.00,China,2009,27566,Energy,Oilfield Services/Equipment
RCS,PIMCO Strategic Income Fund Inc.,$7.79,-0.01,-0.128%,0.00,United States,1994,105810,Finance,Investment Managers
RCUS,Arcus Biosciences Inc. Common Stock,$16.65,1.34,8.752%,1522267958.00,United States,2018,648650,Health Care,Biotechnology: Pharmaceutical Preparations
RDCM,Radcom Ltd. Ordinary Shares,$10.13,0.13,1.30%,155067325.00,Israel,1997,7456,Technology,Computer peripheral equipment
RDDT,Reddit Inc. Class A Common Stock,$72.38,4.91,7.277%,12006108789.00,United States,2024,7419214,Technology,EDP Services
RDFN,Redfin Corporation Common Stock,$11.11,-0.195,-1.725%,1352912029.00,United States,2017,5274008,Finance,Real Estate
RDHL,Redhill Biopharma Ltd. American Depositary Shares,$8.50,0.355,4.359%,10884582.00,Israel,,13008,Health Care,Biotechnology: Pharmaceutical Preparations
RDI,Reading International Inc Class A Common Stock,$1.54,-0.11,-6.667%,34536323.00,United States,,2738,Consumer Discretionary,Movies/Entertainment
RDIB,Reading International Inc Class B Common Stock,$7.74,0.14,1.842%,173578664.00,United States,,10737,Consumer Discretionary,Movies/Entertainment
RDN,Radian Group Inc. Common Stock,$34.81,0.59,1.724%,5236080343.00,United States,,620007,Finance,Property-Casualty Insurers
RDNT,RadNet Inc. Common Stock,$68.67,1.00,1.478%,5078645044.00,United States,,560367,Health Care,Medical Specialities
RDUS,Radius Recycling Inc. Class A Common Stock,$17.90,-0.04,-0.223%,501906227.00,United States,,90969,Consumer Discretionary,Industrial Specialties
RDVT,Red Violet Inc. Common Stock ,$26.99,-0.06,-0.222%,370613617.00,United States,,38527,Technology,Computer Software: Prepackaged Software
RDW,Redwire Corporation Common Stock,$7.24,0.56,8.383%,481717288.00,United States,2021,407570,Industrials,Military/Government/Technical
RDWR,Radware Ltd. Ordinary Shares,$22.41,-0.08,-0.356%,934471811.00,Israel,1999,82647,Consumer Discretionary,Business Services
RDY,Dr. Reddy's Laboratories Ltd Common Stock,$78.27,-1.30,-1.634%,13056865680.00,India,,135017,Health Care,Biotechnology: Pharmaceutical Preparations
RDZN,Roadzen Inc. Ordinary Shares,$0.944,-0.0432,-4.376%,64608143.00,United States,2022,79101,Finance,Specialty Insurers
REAL,The RealReal Inc. Common Stock,$3.23,0.22,7.309%,350449202.00,United States,2019,2244745,Consumer Discretionary,Other Specialty Stores
REAX,The Real Brokerage Inc. Common Shares,$5.75,0.14,2.496%,1123550000.00,Canada,,513712,Finance,Real Estate
REBN,Reborn Coffee Inc. Common Stock,$2.84,-0.06,-2.069%,10657128.00,United States,2022,10964,Consumer Discretionary,Restaurants
RECT,Rectitude Holdings Ltd Ordinary Shares,$3.57,0.21,6.25%,51765000.00,Singapore,2024,27005,Consumer Discretionary,Industrial Machinery/Components
REE,REE Automotive Ltd. Class A Ordinary Shares,$7.64,-0.22,-2.799%,85818821.00,Israel,,89143,Consumer Discretionary,Auto Manufacturing
REFI,Chicago Atlantic Real Estate Finance Inc. Common Stock,$15.42,0.03,0.195%,302609142.00,United States,2021,52592,Real Estate,Real Estate Investment Trusts
REFR,Research Frontiers Incorporated Common Stock,$2.09,-0.07,-3.241%,70052175.00,United States,,19945,Miscellaneous,Multi-Sector Companies
REG,Regency Centers Corporation Common Stock,$70.85,-0.16,-0.225%,12859040770.00,United States,1993,523654,Real Estate,Real Estate Investment Trusts
REGCO,Regency Centers Corporation 5.875% Series B Cumulative Redeemable Preferred Stock,$24.48,-0.04,-0.163%,4443039069.00,United States,,5035,Real Estate,Real Estate Investment Trusts
REGCP,Regency Centers Corporation 6.25% Series A Cumulative Redeemable Preferred Stock,$25.26,-0.07,-0.276%,4584606490.00,United States,,3204,Real Estate,Real Estate Investment Trusts
REGN,Regeneron Pharmaceuticals Inc. Common Stock,$1012.82,-1.77,-0.174%,111647735662.00,United States,1991,1071799,Health Care,Biotechnology: Pharmaceutical Preparations
REI,Ring Energy Inc. Common Stock,$1.74,-0.06,-3.333%,344819927.00,United States,,2819248,Energy,Oil & Gas Production
REKR,Rekor Systems Inc. Common Stock,$1.05,-0.06,-5.405%,92928680.00,United States,,1002249,Telecommunications,Telecommunications Equipment
RELI,Reliance Global Group Inc. Common Stock,$2.33,-0.01,-0.427%,2887818.00,United States,,109581,Finance,Specialty Insurers
RELIW,Reliance Global Group Inc. Series A Warrants,$0.046,-0.024,-34.286%,57013.00,United States,,2500,Finance,Specialty Insurers
RELL,Richardson Electronics Ltd. Common Stock,$12.28,0.22,1.824%,176549204.00,United States,1983,18965,Technology,Electronic Components
RELX,RELX PLC PLC American Depositary Shares (Each representing One Ordinary Share),$46.29,-0.32,-0.687%,86357777680.00,United Kingdom,2015,1634625,Consumer Discretionary,Business Services
RELY,Remitly Global Inc. Common Stock,$13.26,0.37,2.87%,2587510547.00,United States,2021,1148040,Consumer Discretionary,Business Services
RENB,Renovaro Inc. Common Stock,$0.4894,-0.0127,-2.529%,72188920.00,United States,,1300451,Health Care,Biotechnology: Pharmaceutical Preparations
RENE,Cartesian Growth Corporation II Class A Ordinary Shares,$11.47,0.01,0.087%,0.00,United States,2022,7364,Finance,Blank Checks
RENT,Rent the Runway Inc. Class A Common Stock,$9.35,0.31,3.429%,35605922.00,United States,2021,15441,Consumer Discretionary,Other Specialty Stores
REPL,Replimune Group Inc. Common Stock,$11.56,-0.13,-1.112%,789795338.00,United States,2018,418506,Health Care,Biotechnology: Biological Products (No Diagnostic Substances)
REPX,Riley Exploration Permian Inc. Common Stock,$28.25,0.26,0.929%,609501547.00,United States,1999,86043,Energy,Oil & Gas Production
RERE,ATRenew Inc. American Depositary Shares (every three of which representing two Class A ordinary shares),$2.99,0.16,5.654%,662883000.00,Cayman Islands,2021,1845120,Consumer Discretionary,Other Specialty Stores
RES,RPC Inc. Common Stock,$7.00,0.15,2.19%,1505062748.00,United States,,1667357,Energy,Oilfield Services/Equipment
RETO,ReTo Eco-Solutions Inc. Class A Shares,$1.33,0.00,0.00%,4981101.00,China,2017,50452,Industrials,Industrial Machinery/Components
REVB,Revelation Biosciences Inc. Common Stock,$0.8219,0.0064,0.785%,1350706.00,United States,2020,54928,Health Care,Biotechnology: Pharmaceutical Preparations
REVBW,Revelation Biosciences Inc. Warrant,$0.0112,-0.0009,-7.438%,18406.00,United States,2020,118259,Health Care,Biotechnology: Pharmaceutical Preparations
REVG,REV Group Inc. Common Stock,$27.56,0.25,0.915%,1433080066.00,United States,2017,551819,Consumer Discretionary,Auto Manufacturing
REX,REX American Resources Corporation,$46.10,0.55,1.207%,809845707.00,United States,,99623,Industrials,Major Chemicals
REXR,Rexford Industrial Realty Inc. Common Stock,$48.40,-0.39,-0.799%,10623399926.00,United States,2013,1355723,Real Estate,Real Estate Investment Trusts
REXR^B,Rexford Industrial Realty Inc. 5.875% Series B Cumulative Redeemable Preferred Stock,$24.2502,-0.1498,-0.614%,,United States,,1997,,
REXR^C,Rexford Industrial Realty Inc. 5.625% Series C Cumulative Redeemable Preferred Stock par value $0.01 per share,$23.95,-0.08,-0.333%,,United States,,1048,,
REYN,Reynolds Consumer Products Inc. Common Stock,$29.53,-0.14,-0.472%,6205384619.00,United States,2020,323455,Consumer Discretionary,Containers/Packaging
REZI,Resideo Technologies Inc. Common Stock ,$19.66,0.36,1.865%,2878467116.00,United States,2018,584704,Industrials,Wholesale Distributors
RF,Regions Financial Corporation Common Stock,$22.84,0.41,1.828%,20901452214.00,United States,,7376486,Finance,Major Banks
RF^C,Regions Financial Corporation Depositary Shares each Representing a 1/40th Interest in a  Share of 5.700% Fixed-to-Floating Rate Non-Cumulative  Perpetual Preferred Stock Series C,$25.13,-0.11,-0.436%,,United States,,92805,,
RF^E,Regions Financial Corporation Depositary Shares Each Representing a 1/40th Interest in a Share of 4.45% Non-Cumulative Perpetual Preferred Stock Series E,$19.16,-0.14,-0.725%,,United States,,20126,,
RF^F,Regions Financial Corporation Depositary Shares Each Representing a 1/40th Interest in a Share of Non-Cumulative Perpetual Preferred Stock Series F,$26.09,-0.15,-0.572%,,United States,,46322,,
RFAC,RF Acquisition Corp. Class A Common Stock,$11.20,-0.04,-0.356%,0.00,Singapore,2022,2300,Finance,Blank Checks
RFAIU,RF Acquisition Corp II Unit,$10.40,0.00,0.00%,0.00,Singapore,2024,105,Finance,Blank Checks
RFI,Cohen & Steers Total Return Realty Fund Inc. Common Stock,$12.88,0.11,0.861%,632905529.00,United States,1993,65031,Finance,Investment Managers
RFIL,RF Industries Ltd. Common Stock,$4.10,0.05,1.235%,43023289.00,United States,,14380,Technology,Electrical Products
RFL,Rafael Holdings Inc. Class B Common Stock,$2.00,0.03,1.523%,49133332.00,United States,2018,15759,Finance,Real Estate
RFM,RiverNorth Flexible Municipal Income Fund Inc. Common Stock,$16.2979,-0.0021,-0.013%,99656753.00,,2020,11278,Finance,Finance/Investors Services
RFMZ,RiverNorth Flexible Municipal Income Fund II Inc. Common Stock,$14.55,0.01,0.069%,354318050.00,,2021,67461,Finance,Trusts Except Educational Religious and Charitable
RGA,Reinsurance Group of America Incorporated Common Stock,$219.94,5.29,2.464%,14484731101.00,United States,,314884,Finance,Life Insurance
RGC,Regencell Bioscience Holdings Limited Ordinary Shares,$4.35,-0.51,-10.494%,56605967.00,Hong Kong,2021,12826,Health Care, Medicinal Chemicals and Botanical Products 
RGCO,RGC Resources Inc. Common Stock,$21.03,0.60,2.937%,214903341.00,United States,,4159,Utilities,Oil & Gas Production
RGEN,Repligen Corporation Common Stock,$136.71,-2.33,-1.676%,7656648342.00,United States,1986,596372,Health Care,Biotechnology: Biological Products (No Diagnostic Substances)
RGF,The Real Good Food Company Inc. Class A Common Stock,$0.3739,0.0241,6.89%,12594524.00,United States,2021,275474,Consumer Staples,Packaged Foods
RGLD,Royal Gold Inc. Common Stock,$138.97,-0.31,-0.223%,9136006758.00,United States,,178088,Industrials,Precious Metals
RGLS,Regulus Therapeutics Inc. Common Stock,$1.58,-0.05,-3.067%,103436084.00,United States,2012,216781,Health Care,Biotechnology: Pharmaceutical Preparations
RGNX,REGENXBIO Inc. Common Stock,$9.72,0.37,3.957%,480393387.00,United States,2015,446711,Health Care,Biotechnology: Biological Products (No Diagnostic Substances)
RGP,Resources Connection Inc. Common Stock,$8.37,0.01,0.12%,280898456.00,United States,,789460,Consumer Discretionary,Business Services
RGR,Sturm Ruger & Company Inc. Common Stock,$40.84,0.11,0.27%,688364285.00,United States,,85226,Industrials,Ordnance And Accessories
RGS,Regis Corporation Common Stock,$27.29,1.00,3.804%,62219781.00,United States,1991,39329,Consumer Discretionary,Other Consumer Services
RGT,Royce Global Trust Inc. Common Stock,$11.57,0.0499,0.433%,72508531.00,,2013,4136,Finance,Trusts Except Educational Religious and Charitable
RGTI,Rigetti Computing Inc. Common Stock,$0.7849,0.0369,4.933%,150107017.00,United States,,1985299,Technology,EDP Services
RGTIW,Rigetti Computing Inc. Warrants,$0.0995,0.0095,10.556%,19028727.00,United States,,920,Technology,EDP Services
RH,RH Common Stock,$332.84,-1.23,-0.368%,6151780869.00,United States,2012,495588,Consumer Discretionary,Other Specialty Stores
RHE,Regional Health Properties Inc. Common Stock,$1.8099,0.0599,3.423%,3446100.00,,2017,4964,Real Estate,Real Estate
RHE^A,Regional Health Properties Inc. 10.875% Series A Cumulative Redeemable Preferred Stock,$0.5101,0.00,0.00%,,,,50,,
RHI,Robert Half Inc. Common Stock,$66.62,0.14,0.211%,6932244563.00,United States,,779960,Consumer Discretionary,Professional Services
RHP,Ryman Hospitality Properties Inc. (REIT),$112.56,4.57,4.232%,6742347489.00,United States,,611684,Real Estate,Real Estate Investment Trusts
RICK,RCI Hospitality Holdings Inc. Common Stock,$41.92,0.29,0.697%,377135208.00,United States,1995,39719,Consumer Discretionary,Restaurants
RIG,Transocean Ltd (Switzerland) Common Stock,$4.67,0.09,1.965%,4088445829.00,Switzerland,,23493327,Energy,Oil & Gas Production
RIGL,Rigel Pharmaceuticals Inc. Common Stock,$16.04,-0.01,-0.062%,282223431.00,United States,2000,62060,Health Care,Biotechnology: Pharmaceutical Preparations
RILY,B. Riley Financial Inc. Common Stock,$4.87,-0.18,-3.564%,147538126.00,United States,,3093694,Finance,Investment Managers
RILYG,B. Riley Financial Inc. 5.00% Senior Notes due 2026,$10.88,-0.52,-4.561%,329612897.00,United States,,46157,Finance,Investment Managers
RILYK,B. Riley Financial Inc. 5.50% Senior Notes Due 2026,$16.85,-0.43,-2.488%,510475856.00,United States,,30459,Finance,Investment Managers
RILYL,B. Riley Financial Inc. Depositary Shares each representing 1/1000th in a share of 7.375% Series B Cumulative Perpetual Preferred Stock par value $0.0001,$7.8713,-0.4767,-5.71%,238463419.00,United States,,7055,Finance,Investment Managers
RILYM,B. Riley Financial Inc. 6.375% Senior Notes due 2025,$20.93,-0.8396,-3.857%,634080692.00,United States,,201311,Finance,Investment Managers
RILYN,B. Riley Financial Inc. 6.50% Senior Notes Due 2026,$11.64,-0.91,-7.251%,352637327.00,United States,,81466,Finance,Investment Managers
RILYP,B. Riley Financial Inc. Depositary Shares each representing a 1/1000th fractional interest in a share of Series A Cumulative Perpetual Preferred Stock,$7.89,-0.83,-9.518%,239029941.00,United States,,9728,Finance,Investment Managers
RILYT,B. Riley Financial Inc. 6.00% Senior Notes Due 2028,$8.8674,-0.6326,-6.659%,268640570.00,United States,,70948,Finance,Investment Managers
RILYZ,B. Riley Financial Inc. 5.25% Senior Notes due 2028,$8.15,-0.67,-7.596%,246906719.00,United States,,154668,Finance,Investment Managers
RIME,Algorhythm Holdings Inc. Common Stock,$0.462,-0.0239,-4.919%,4498425.00,United States,,96942,Consumer Staples,Diversified Electronic Products
RIO,Rio Tinto Plc Common Stock,$69.70,-0.13,-0.186%,87312052217.00,Australia,2002,2066070,Basic Materials,Metal Mining
RIOT,Riot Platforms Inc. Common Stock ,$7.85,0.42,5.653%,2382663926.00,United States,,20294711,Finance,Finance: Consumer Services
RITM,Rithm Capital Corp. Common Stock,$10.81,0.00,0.00%,5294007482.00,United States,,8919307,Real Estate,Real Estate Investment Trusts
RITM^A,Rithm Capital Corp. 7.50% Series A Fixed-to-Floating Rate Cumulative Redeemable Preferred Stock,$25.90,0.2119,0.825%,,United States,,142927,,
RITM^B,Rithm Capital Corp. 7.125% Series B Fixed-to-Floating Rate Cumulative Redeemable Preferred Stock,$25.595,0.045,0.176%,,United States,,31529,,
RITM^C,Rithm Capital Corp. 6.375% Series C Fixed-to-Floating Rate Cumulative Redeemable Preferred Stock,$24.28,-0.0383,-0.157%,,United States,,28400,,
RITM^D,Rithm Capital Corp. 7.00% Fixed-Rate Reset Series D Cumulative Redeemable Preferred Stock,$24.26,0.00,0.00%,,United States,,22162,,
RITR,Reitar Logtech Holdings Limited Ordinary shares,$4.97,-0.20,-3.868%,408161250.00,Hong Kong,2024,92208,Finance,Real Estate
RIV,RiverNorth Opportunities Fund Inc. Common Stock,$12.88,-0.07,-0.541%,0.00,United States,2015,91216,Finance,Finance Companies
RIV^A,RiverNorth Opportunities Fund Inc. 6.00% Series A Perpetual Preferred Stock,$24.46,-0.08,-0.326%,,United States,,7398,,
RIVN,Rivian Automotive Inc. Class A Common Stock,$10.44,-0.34,-3.154%,10526376802.00,United States,2021,76716650,Consumer Discretionary,Auto Manufacturing
RJF,Raymond James Financial Inc. Common Stock,$127.13,2.43,1.949%,26181589527.00,United States,,1035031,Finance,Investment Bankers/Brokers/Service
RJF^B,Raymond James Financial Inc. Depositary Shares each representing a 1/40th interest in a share of 6.375% Fixed-to-Floating Rate Series B Non-Cumulative Perpetual Preferred Stock,$25.215,-0.05,-0.198%,,United States,,4203,,
RKDA,Arcadia Biosciences Inc. Common Stock,$2.79,-0.02,-0.712%,3802324.00,United States,2015,2747,Consumer Staples,Farming/Seeds/Milling
RKLB,Rocket Lab USA Inc. Common Stock,$9.80,0.55,5.946%,4867073421.00,United States,2020,10754750,Industrials,Military/Government/Technical
RKT,Rocket Companies Inc. Class A Common Stock,$17.52,-0.55,-3.044%,34855132902.00,United States,2020,6353208,Finance,Finance: Consumer Services
RL,Ralph Lauren Corporation Common Stock,$196.17,3.76,1.954%,12150647782.00,United States,1997,531411,Consumer Discretionary,Apparel
